ФИЗТЕХ-ШКОЛА РАДИОТЕХНИКИ И КОМПЬЮТЕРНЫХ ТЕХНОЛОГИЙ (ФРКТ);Физтех-школа радиотехники и компьютерных технологий готовит специалистов в области инфо-коммуникационных и вычислительных систем и технологий, беспроводной связи и радиолокации, информационной безопасности. Помимо базовых дисциплин, таких как физика и математика, в программе подготовки делается акцент на обучение инженерии, радиоэлектронике, Computer Science и управлению технически сложными системами. Фундаментальная, но вместе с тем практически направленная подготовка в физтех-школе радиотехники и компьютерных технологий – это ценный капитал и прочная основа для дальнейшей успешной самореализации выпускников.;141701, Московская обл., г. Долгопрудный, Институтский пер., 7, МФТИ, Аудиторный корпус, каб. 306-307.;+7-495-408-54-90;+7-495-408-52-88;frkt@mipt.ru;https://mipt.ru/education/departments/frkt/;
ФИЗТЕХ-ШКОЛА ФИЗИКИ И ИССЛЕДОВАНИЙ ИМ. ЛАНДАУ (ЛФИ);Физтех-школа физики и исследований им. Ландау (физтех-школа фундаментальной и прикладной физики) осуществляет фундаментальную подготовку специалистов, способных совершать научные открытия на самых передовых рубежах физики и наукоёмких технологий. Выпускники нацелены на исследования проблем общемировой научной повестки в условиях жесткой конкуренции и международной интеграции на горизонте познания физических закономерностей в области квантовых компьютеров и нано-физики, изучения происхождения и строения материи, Вселенной и сил природы, создания теории великого синтеза всех взаимодействий и решения проблем инновационных энергетических технологий. Выпускники физтех-школа физики и исследований им. Ландау успешно работают в исследовательских институтах России и за рубежом.;141701, Московская обл., г. Долгопрудный, Институтский пер., 7, МФТИ, Аудиторный корпус, каб. 301-303, каб. 309-311.;+7 (495) 408-80-77;+7 (495) 408-53-55;lpr@mipt.ru;https://mipt.ru/education/departments/lpr/;
ФИЗТЕХ-ШКОЛА АЭРОКОСМИЧЕСКИХ ТЕХНОЛОГИЙ (ФАКТ);Физтех-школа аэрокосмических технологий является наследником знаменитого Аэромеха — одного из первых факультетов МФТИ. В состав Школы входят более двух десятков базовых кафедр и лабораторий, которые выполняют научно-исследовательские и опытно-конструкторские работы в интересах авиационной и космической промышленности России. Школа занимает ведущие позиции в области наук о Земле и разработке прикладных программных комплексов.;141701, Московская обл., г. Долгопрудный, Институтский пер., 7, МФТИ, Аудиторный корпус, каб. 401-402 (ФАКИ)/n40180, Московская область, г. Жуковский, ул. Гагарина, д. 16 (ФАЛТ);+7 (495) 408-53-44;+7 (495) 556-84-17;astech@mipt.ru;https://fakt.mipt.ru/;
ФИЗТЕХ-ШКОЛА ЭЛЕКТРОНИКИ, ФОТОНИКИ И МОЛЕКУЛЯРНОЙ ФИЗИКИ (ФЭФМ);Физтех-школа электроники, фотоники и молекулярной физики  объединила ведущие технологические направления грядущей четвёртой индустриальной революции: развитие новой электроники, фотоники, уникальных материалов с заданными свойствами, аддитивных и нано- технологий, определяющие то, каким будет выглядеть мир завтра. При всей широте спектра ключевых технологий будущего, научная основа их функционирования была и остаётся единой. Именно на неё традиционно ориентирована образовательная миссия физтех-школы электроники, фотоники и молекулярной физики. Фундаментальная подготовка и учебная практика проведения прикладных исследований обеспечивают студентов возможностью реализовать свои таланты как в науке, так и в лидирующих технологических компаниях по всему миру.;141701, Московская обл., г. Долгопрудный, Институтский пер., 7, МФТИ, Аудиторный корпус, каб. 505, 506.;+7 (495) 408-56-27;+7 (495) 408-59-66;fefm@mipt.ru;https://mipt.ru/education/departments/fefm/;
ФИЗТЕХ-ШКОЛА ПРИКЛАДНОЙ МАТЕМАТИКИ И ИНФОРМАТИКИ (ФПМИ);ФПМИ - это совершенно уникальная Школа, в которой собраны самые современные компетенции в области математики и информатики. В Школе представлены одновременно и лучшие академические базовые организации, и ведущие индустриальные базовые компании. Но они не существуют порознь! Они теснейшим образом сотрудничают на площадках лабораторий Школы. Поступая на академическую кафедру, студент имеет возможность сразу же применить полученные знания при реализации живых современных проектов под руководством научных сотрудников своей кафедры и кураторов от индустрии. Такая же возможность взаимодействия с Академией есть и у студентов индустриальных базовых организаций. Разумеется, есть в Школе и масса возможностей для занятия фундаментальными исследованиями: для этого есть и кафедры, и лаборатории с соответствующим профилем. Но главное для нас - это то, что только у нас есть уникальная возможность оказаться в самом центре современной математики и ее приложений, только у нас Академия встречается с индустрией в таком количестве разнообразных и проактивно меняющихся проектов.;141701, Московская обл., г. Долгопрудный, Институтский пер., 7, МФТИ, Аудиторный корпус, каб. 601-602, 406-407.;+7 (495) 408-52-11;+7 (495) 408-47-18;fpmi@mipt.ru;https://mipt.ru/education/departments/fpmi/;
ФИЗТЕХ-ШКОЛА БИОЛОГИЧЕСКОЙ И МЕДИЦИНСКОЙ ФИЗИКИ (ФБМФ);Физтех-школа биологической и медицинской физики дает мультидисциплинарную подготовку, готовит специалистов, обладающих знаниями в областях физики, математики, информатики, химии и биологии, а также специальными знаниями в сфере биотехнологий, включая био- и хемоинформатику, ОМИКсные технологии. Программа включает курс по разработке медицинских изделий, а также предполагает подготовку обучающихся ведению проектной деятельности для развития биотехнологического бизнеса. Выпускники физтех-школы биологической и медицинской физики имеют большую свободу выбора профессиональной карьеры.;141701, Московская обл., г. Долгопрудный, Институтский пер., 7, МФТИ, Аудиторный корпус, каб. 501-502.;+7 (495) 576-07-14;dbmp@mipt.ru;https://mipt.ru/education/departments/fbmf/;
ИНСТИТУТ НАНО-, БИО-, ИНФОРМАЦИОННЫХ, КОГНИТИВНЫХ И СОЦИОГУМАНИТАРНЫХ НАУК И ТЕХНОЛОГИЙ (ИНБИКСТ);Создание института нано-, био-, информационных, когнитивных и социогуманитарных наук и технологий было обусловлено необходимостью подготовки междисциплинарно образованных специалистов, ориентированных на решение задач в области природоподобных технологий, основанных на физике наносистем, молекулярной биологии, белковой инженерии, супрамолекулярной химии, нейрокогнитивных технологиях, многоуровневом моделировании и информационных системах.
Самые удивительные и наиболее прорывные открытия последних лет происходят на стыке разных наук – физики и медицины, информатики и биологии. Чтобы успешно проводить сложные междисциплинарные исследования, нужны специалисты нового типа.
В институте нано-, био-, информационных, когнитивных и социогуманитарных наук и технологий (ИНБИКСТ) на базе МФТИ и НИЦ "Курчатовский институт" впервые реализуется междисциплинарная система подготовки таких специалистов;141701, Московская обл., г. Долгопрудный, Институтский пер., 7, МФТИ, Аудиторный корпус, каб. 503\n123098, г. Москва, ул. Максимова, д. 4.;+7 (495) 408-69-80; +7 (499) 196-53-11;inbicst@mipt.ru;https://inbicst.ru/applicants/;
